{
  "schema": 3,
  "run_id": "run-20260927-182054-graft-FAFF-1138",
  "seq": 0,
  "ts": "2026-09-27T18:20:54.905Z",
  "author": "commissaire",
  "producer_id": "run-20260927-182054-graft-FAFF-1138",
  "contract_revision": "faff-runner-v1",
  "kind_of_entry": "admission",
  "issue": "-",
  "step": "admit",
  "prev": "b926f1917d72e140777bc04f9ebb246b2eec8c5bf7e238f64fa0781d7d1a9875",
  "payload": {
    "producer_id": "run-20260927-182054-graft-FAFF-1138",
    "contract_revision": "faff-runner-v1",
    "admitted_scope": ["merge", "branch-delete", "pr-create", "push", "label-write", "file-write", "tracker-write"],
    "pk_fingerprint": "19dd46d704eb0f3ce592e739a9759935b4cd043b54528c3f2835455957c76b57",
    "admitted_at": "2026-09-27T18:20:54.903Z"
  },
  "commissaire_sig": "ERiVwPkfZ9TCjJGm8RNO6pWydLyN1AOWG6u1UQ3wYPM35dWsNER2Zw0L8ZahWja+fBedNrgljrwPsLbJlQnwCw=="
}
